[
  {
    "task_id": "SYNTHETIC-waste",
    "agent": "codex",
    "task_key": "SYNTHETIC-fix-parser",
    "difficulty": "easy",
    "acceptance_id": "SYNTHETIC-parser-tests-v1",
    "status": "failed",
    "accepted": false,
    "baseline_minutes": "60",
    "baseline_verified": false,
    "human_minutes": "15",
    "rework_minutes": "30",
    "hourly_rate": "36",
    "currency": "USD",
    "synthetic": true
  }
]
